{
  "$schema": "https://json-schema.org/draft/2020-12/schema",
  "$id": "strataos/claim.schema.json",
  "title": "Claim",
  "type": "object",
  "additionalProperties": false,
  "required": [
    "claim_id",
    "decision_model_version",
    "person_id",
    "opportunity_id",
    "predicate",
    "value",
    "polarity",
    "confidence",
    "evidence_ids"
  ],
  "properties": {
    "claim_id": { "type": "string", "minLength": 1 },
    "decision_model_version": { "type": "string", "minLength": 1 },
    "person_id": { "type": "string", "minLength": 1 },
    "opportunity_id": { "type": "string", "minLength": 1 },
    "predicate": { "type": "string", "minLength": 1 },
    "value": {},
    "polarity": { "type": "string", "enum": ["positive", "negative"] },
    "confidence": { "type": "number", "minimum": 0.0, "maximum": 1.0 },
    "evidence_ids": {
      "type": "array",
      "minItems": 1,
      "items": { "type": "string", "minLength": 1 }
    },
    "version": { "type": "integer", "minimum": 1 },
    "explanation": { "type": "string" }
  }
}
